{
  "id": "appearance-mario-balotelli-2009",
  "personId": "person-mario-balotelli",
  "imageId": "mario-balotelli-2009-inter",
  "event": "Inter Milan match",
  "taken": {
    "value": "2009-08-16",
    "precision": "day",
    "sourceUrl": "https://commons.wikimedia.org/wiki/File:Mario_Balotelli_-_Inter_Mailand_(1).jpg"
  },
  "observations": [
    {
      "hairstyleId": "hairstyle-buzz-cut",
      "visualDescription": "A close-cropped, even silhouette with a neat, low profile is visible from the front and crown."
    }
  ]
}
