{
  "id": "appearance-dennis-rodman-2005-topo",
  "personId": "person-dennis-rodman",
  "imageId": "dennis-rodman-2005-topo",
  "event": "Torpan Pojat game in Helsinki",
  "taken": {
    "value": "2005",
    "precision": "year",
    "sourceUrl": "https://commons.wikimedia.org/wiki/File:Dennis_Rodman_ToPo.jpg"
  },
  "observations": [
    {
      "hairstyleId": "hairstyle-buzz-cut",
      "visualDescription": "The photograph shows an evenly clipped, close cut with bleached-blond hair. The visible length and outline fit a buzz cut; the hair color is dyed."
    }
  ]
}
