{
  "id": "appearance-diana-red-cross-landmine-campaign-1997",
  "personId": "person-diana-princess-of-wales",
  "event": "American Red Cross headquarters visit for the anti-landmine campaign",
  "taken": {
    "value": "1997-06-17",
    "precision": "day",
    "sourceUrl": "https://www.washingtonpost.com/archive/lifestyle/1997/06/18/from-london-a-blitz-with-glitz/e597a0dc-b04b-41d3-b901-e28dfa85c2bb/"
  },
  "observations": []
}
